{
  "contract": "otc.mobile.table/1.0",
  "request_id": "req_inspect_sheet",
  "table_uri": "file:///data/orders.xlsx#sheet=Orders",
  "mode": "sheet",
  "schema_fingerprint": "sha256:schema-sheet",
  "row_count": 2,
  "source_revision": "sha256:source-sheet",
  "coordinate_convention": {"mode": "sheet", "record_id_field": null, "key_fields": [], "ordinal_snapshot_id": "sha256:ordinal"},
  "fields": [
    {"id": "A", "label": "Status", "type": "string", "nullable": true, "editable": false, "read_only_reason": "stable_record_id_required"},
    {"id": "B", "label": "Amount", "type": "number", "nullable": true, "editable": false, "read_only_reason": "stable_record_id_required"}
  ]
}
